{
  "artifact_type": "hyperray_certificate_proposal",
  "schema_version": 2,
  "artifact_id": "certificate.threshold.fixture",
  "certificate_id": "certificate.threshold",
  "certificate_kind": "proved_completeness_threshold",
  "subject_artifacts": [
    {
      "artifact_id": "model",
      "artifact_type": "hyperray_model",
      "schema_version": 2,
      "sha256": "0000000000000000000000000000000000000000000000000000000000000000"
    }
  ],
  "producer": {
    "name": "bmc-checker",
    "version": "1",
    "executable_sha256": "0000000000000000000000000000000000000000000000000000000000000000",
    "arguments": []
  },
  "evidence": {
    "property_kind": "termination",
    "model_encoding": "sequential_circuit",
    "threshold": "31",
    "path_measure": "number_of_steps",
    "threshold_proof": {
      "obligation_id": "threshold.complete",
      "statement_artifact": {
        "artifact_id": "obligation.threshold.complete",
        "artifact_type": "proof_obligation",
        "schema_version": 1,
        "sha256": "0000000000000000000000000000000000000000000000000000000000000000"
      },
      "proof_artifact": {
        "artifact_id": "proof.threshold",
        "artifact_type": "proof_evidence",
        "schema_version": 1,
        "sha256": "0000000000000000000000000000000000000000000000000000000000000000"
      }
    },
    "bounded_absence_proof": {
      "obligation_id": "bounded.absence",
      "statement_artifact": {
        "artifact_id": "obligation.bounded.absence",
        "artifact_type": "proof_obligation",
        "schema_version": 1,
        "sha256": "0000000000000000000000000000000000000000000000000000000000000000"
      },
      "proof_artifact": {
        "artifact_id": "proof.bounded",
        "artifact_type": "proof_evidence",
        "schema_version": 1,
        "sha256": "0000000000000000000000000000000000000000000000000000000000000000"
      }
    }
  }
}
