{
  "artifact_type": "hyperray_certificate_proposal",
  "schema_version": 2,
  "artifact_id": "certificate.coverage.fixture",
  "certificate_id": "certificate.coverage",
  "certificate_kind": "symbolic_coverage_equivalence",
  "subject_artifacts": [
    {
      "artifact_id": "coverage",
      "artifact_type": "hyperray_semantic_coverage",
      "schema_version": 2,
      "sha256": "0000000000000000000000000000000000000000000000000000000000000000"
    }
  ],
  "producer": {
    "name": "coverage-checker",
    "version": "1",
    "executable_sha256": "0000000000000000000000000000000000000000000000000000000000000000",
    "arguments": []
  },
  "evidence": {
    "coverage_artifact": {
      "artifact_id": "coverage",
      "artifact_type": "hyperray_semantic_coverage",
      "schema_version": 2,
      "sha256": "0000000000000000000000000000000000000000000000000000000000000000"
    },
    "model_artifact": {
      "artifact_id": "model",
      "artifact_type": "hyperray_model",
      "schema_version": 2,
      "sha256": "0000000000000000000000000000000000000000000000000000000000000000"
    },
    "proof_records": {
      "inventory_dispositions": {
        "obligation_id": "inventory",
        "statement_artifact": {
          "artifact_id": "obligation.inventory",
          "artifact_type": "proof_obligation",
          "schema_version": 1,
          "sha256": "0000000000000000000000000000000000000000000000000000000000000000"
        },
        "proof_artifact": {
          "artifact_id": "proof.inventory",
          "artifact_type": "proof_evidence",
          "schema_version": 1,
          "sha256": "0000000000000000000000000000000000000000000000000000000000000000"
        }
      },
      "mapped_forward_paths": {
        "obligation_id": "forward",
        "statement_artifact": {
          "artifact_id": "obligation.forward",
          "artifact_type": "proof_obligation",
          "schema_version": 1,
          "sha256": "0000000000000000000000000000000000000000000000000000000000000000"
        },
        "proof_artifact": {
          "artifact_id": "proof.forward",
          "artifact_type": "proof_evidence",
          "schema_version": 1,
          "sha256": "0000000000000000000000000000000000000000000000000000000000000000"
        }
      },
      "eliminated_equivalence": {
        "obligation_id": "eliminated",
        "statement_artifact": {
          "artifact_id": "obligation.eliminated",
          "artifact_type": "proof_obligation",
          "schema_version": 1,
          "sha256": "0000000000000000000000000000000000000000000000000000000000000000"
        },
        "proof_artifact": {
          "artifact_id": "proof.eliminated",
          "artifact_type": "proof_evidence",
          "schema_version": 1,
          "sha256": "0000000000000000000000000000000000000000000000000000000000000000"
        }
      },
      "compiler_output_reverse_map": {
        "obligation_id": "compiler.reverse",
        "statement_artifact": {
          "artifact_id": "obligation.compiler.reverse",
          "artifact_type": "proof_obligation",
          "schema_version": 1,
          "sha256": "0000000000000000000000000000000000000000000000000000000000000000"
        },
        "proof_artifact": {
          "artifact_id": "proof.compiler.reverse",
          "artifact_type": "proof_evidence",
          "schema_version": 1,
          "sha256": "0000000000000000000000000000000000000000000000000000000000000000"
        }
      },
      "image_instruction_reverse_map": {
        "obligation_id": "image.reverse",
        "statement_artifact": {
          "artifact_id": "obligation.image.reverse",
          "artifact_type": "proof_obligation",
          "schema_version": 1,
          "sha256": "0000000000000000000000000000000000000000000000000000000000000000"
        },
        "proof_artifact": {
          "artifact_id": "proof.image.reverse",
          "artifact_type": "proof_evidence",
          "schema_version": 1,
          "sha256": "0000000000000000000000000000000000000000000000000000000000000000"
        }
      },
      "semantic_case_reverse_map": {
        "obligation_id": "semantic.reverse",
        "statement_artifact": {
          "artifact_id": "obligation.semantic.reverse",
          "artifact_type": "proof_obligation",
          "schema_version": 1,
          "sha256": "0000000000000000000000000000000000000000000000000000000000000000"
        },
        "proof_artifact": {
          "artifact_id": "proof.semantic.reverse",
          "artifact_type": "proof_evidence",
          "schema_version": 1,
          "sha256": "0000000000000000000000000000000000000000000000000000000000000000"
        }
      },
      "model_effect_reverse_map": {
        "obligation_id": "effect.reverse",
        "statement_artifact": {
          "artifact_id": "obligation.effect.reverse",
          "artifact_type": "proof_obligation",
          "schema_version": 1,
          "sha256": "0000000000000000000000000000000000000000000000000000000000000000"
        },
        "proof_artifact": {
          "artifact_id": "proof.effect.reverse",
          "artifact_type": "proof_evidence",
          "schema_version": 1,
          "sha256": "0000000000000000000000000000000000000000000000000000000000000000"
        }
      },
      "exact_roots": {
        "obligation_id": "roots",
        "statement_artifact": {
          "artifact_id": "obligation.roots",
          "artifact_type": "proof_obligation",
          "schema_version": 1,
          "sha256": "0000000000000000000000000000000000000000000000000000000000000000"
        },
        "proof_artifact": {
          "artifact_id": "proof.roots",
          "artifact_type": "proof_evidence",
          "schema_version": 1,
          "sha256": "0000000000000000000000000000000000000000000000000000000000000000"
        }
      },
      "query_root_applicability": {
        "obligation_id": "query.roots",
        "statement_artifact": {
          "artifact_id": "obligation.query.roots",
          "artifact_type": "proof_obligation",
          "schema_version": 1,
          "sha256": "0000000000000000000000000000000000000000000000000000000000000000"
        },
        "proof_artifact": {
          "artifact_id": "proof.query.roots",
          "artifact_type": "proof_evidence",
          "schema_version": 1,
          "sha256": "0000000000000000000000000000000000000000000000000000000000000000"
        }
      },
      "exact_counts": {
        "obligation_id": "counts",
        "statement_artifact": {
          "artifact_id": "obligation.counts",
          "artifact_type": "proof_obligation",
          "schema_version": 1,
          "sha256": "0000000000000000000000000000000000000000000000000000000000000000"
        },
        "proof_artifact": {
          "artifact_id": "proof.counts",
          "artifact_type": "proof_evidence",
          "schema_version": 1,
          "sha256": "0000000000000000000000000000000000000000000000000000000000000000"
        }
      },
      "artifact_digest_resolution": {
        "obligation_id": "digests",
        "statement_artifact": {
          "artifact_id": "obligation.digests",
          "artifact_type": "proof_obligation",
          "schema_version": 1,
          "sha256": "0000000000000000000000000000000000000000000000000000000000000000"
        },
        "proof_artifact": {
          "artifact_id": "proof.digests",
          "artifact_type": "proof_evidence",
          "schema_version": 1,
          "sha256": "0000000000000000000000000000000000000000000000000000000000000000"
        }
      }
    }
  }
}
