{
  "artifact_type": "hyperray_certificate_proposal",
  "schema_version": 2,
  "artifact_id": "certificate.count.fixture",
  "certificate_id": "certificate.count",
  "certificate_kind": "symbolic_exact_count",
  "subject_artifacts": [
    {
      "artifact_id": "model",
      "artifact_type": "hyperray_model",
      "schema_version": 2,
      "sha256": "0000000000000000000000000000000000000000000000000000000000000000"
    }
  ],
  "producer": {
    "name": "count-checker",
    "version": "1",
    "executable_sha256": "0000000000000000000000000000000000000000000000000000000000000000",
    "arguments": []
  },
  "evidence": {
    "counted_set": "enabled_choice_assignments",
    "exact_count": "13",
    "count_proof": {
      "obligation_id": "count.exact",
      "statement_artifact": {
        "artifact_id": "obligation.count.exact",
        "artifact_type": "proof_obligation",
        "schema_version": 1,
        "sha256": "0000000000000000000000000000000000000000000000000000000000000000"
      },
      "proof_artifact": {
        "artifact_id": "proof.count",
        "artifact_type": "proof_evidence",
        "schema_version": 1,
        "sha256": "0000000000000000000000000000000000000000000000000000000000000000"
      }
    }
  }
}
