{
  "artifact_type": "hyperray_certificate_proposal",
  "schema_version": 2,
  "artifact_id": "certificate.invariant.fixture",
  "certificate_id": "certificate.invariant",
  "certificate_kind": "safety_inductive_invariant",
  "subject_artifacts": [
    {
      "artifact_id": "model",
      "artifact_type": "hyperray_model",
      "schema_version": 2,
      "sha256": "0000000000000000000000000000000000000000000000000000000000000000"
    }
  ],
  "producer": {
    "name": "ic3-checker",
    "version": "1",
    "executable_sha256": "0000000000000000000000000000000000000000000000000000000000000000",
    "arguments": []
  },
  "evidence": {
    "property_kind": "safety",
    "model_encoding": "sequential_circuit",
    "invariant_artifact": {
      "artifact_id": "proof.invariant",
      "artifact_type": "proof_evidence",
      "schema_version": 1,
      "sha256": "0000000000000000000000000000000000000000000000000000000000000000"
    },
    "initiation": {
      "obligation_id": "initiation",
      "statement_artifact": {
        "artifact_id": "obligation.initiation",
        "artifact_type": "proof_obligation",
        "schema_version": 1,
        "sha256": "0000000000000000000000000000000000000000000000000000000000000000"
      },
      "proof_artifact": {
        "artifact_id": "proof.initiation",
        "artifact_type": "proof_evidence",
        "schema_version": 1,
        "sha256": "0000000000000000000000000000000000000000000000000000000000000000"
      }
    },
    "consecution": {
      "obligation_id": "consecution",
      "statement_artifact": {
        "artifact_id": "obligation.consecution",
        "artifact_type": "proof_obligation",
        "schema_version": 1,
        "sha256": "0000000000000000000000000000000000000000000000000000000000000000"
      },
      "proof_artifact": {
        "artifact_id": "proof.consecution",
        "artifact_type": "proof_evidence",
        "schema_version": 1,
        "sha256": "0000000000000000000000000000000000000000000000000000000000000000"
      }
    },
    "state_safety": {
      "obligation_id": "state.safety",
      "statement_artifact": {
        "artifact_id": "obligation.state.safety",
        "artifact_type": "proof_obligation",
        "schema_version": 1,
        "sha256": "0000000000000000000000000000000000000000000000000000000000000000"
      },
      "proof_artifact": {
        "artifact_id": "proof.state.safety",
        "artifact_type": "proof_evidence",
        "schema_version": 1,
        "sha256": "0000000000000000000000000000000000000000000000000000000000000000"
      }
    },
    "transition_safety": {
      "obligation_id": "transition.safety",
      "statement_artifact": {
        "artifact_id": "obligation.transition.safety",
        "artifact_type": "proof_obligation",
        "schema_version": 1,
        "sha256": "0000000000000000000000000000000000000000000000000000000000000000"
      },
      "proof_artifact": {
        "artifact_id": "proof.transition.safety",
        "artifact_type": "proof_evidence",
        "schema_version": 1,
        "sha256": "0000000000000000000000000000000000000000000000000000000000000000"
      }
    }
  }
}
